original_sentence,orig_sent_id,changed_sentence,changed_sent_id,original_file_name,orig_ann,changed_ann
"Слідчі встановили, що у 2018-2019 рр. управління ЖКГ Чернігівської міськради та ТОВ «Армшляхбуд» уклали низку договорів на загальну суму 91,89 млн грн.",2,"Слідчі встановили, що у 2018-2019 рр. управління ЖКГ Чернігівської міськради та ТОВ «Армшляхбуд» уклали низку договорів на загальну суму 91,89 млн грн.",2,104263660695.txt,"{'T6': ('Слідчі', 'JOB')}","{'T6': ('Слідчі', 'JOB')}"
"Суд надав слідчим доступ до документації щодо 49 угод, які знаходяться в ТОВ «Армшляхбуд» та управлінні ЖКГ.",7,"Суд надав слідчій доступ до документації щодо 49 угод, які знаходяться в ТОВ «Армшляхбуд» та управлінні ЖКГ.",7,104263660695.txt,"{'T23': ('слідчим', 'JOB')}","{'T23': ('слідчій', 'JOB')}"
"Директором та засновником ТОВ «Армшляхбуд», створеного у лютому 2018 р., є Андранік Мкртчян.",8,"Директоркою та засновницею ТОВ «Армшляхбуд», створеного у лютому 2018 р., є Валентина Мкртчян.",8,104263660695.txt,"{'T25': ('Директором', 'JOB'), 'T26': ('засновником', 'JOB')}","{'T25': ('Директоркою', 'JOB'), 'T26': ('засновницею', 'JOB')}"
"Співвласником цієї компанії у свою чергу з часткою в 75% є Іван Плачков, голова наглядової ради ПАТ «Київенерго», яке і проводило тендер.",5,"Співвласницею цієї компанії у свою чергу з часткою в 75% є Марія Плачкова, голова наглядової ради ПАТ «Київенерго», яке і проводило тендер.",5,97c7987b8f9c.txt,"{'T17': ('голова наглядової ради', 'JOB')}","{'T17': ('голова наглядової ради', 'JOB')}"
"Одесит Іван Плачков почав працювати в компанії понад 20 років тому, з середини 90-х займає у ній керівні посади, у 1995-99 вперше стає головою правління «Київенерго».",6,"Одеситка Іванна Плачкова почала працювати в компанії понад 20 років тому, з середини 90-х займає у ній керівні посади, у 1995-99 вперше стає головою правління «Київенерго».",6,97c7987b8f9c.txt,"{'T25': ('головою правління', 'JOB')}","{'T25': ('головою правління', 'JOB')}"
"У 1999 очолив Міністерство енергетики України, потім – знову «Київенерго» у 2000-2005 р. р. ; у 2005-2006 міністр палива та енергетики України ; багаторазовий депутат Київської міськради, з 2008 – у фракції Кличка.",7,"У 1999 очолила Міністерство енергетики України, потім – знову «Київенерго» у 2000-2005 р. р. ; у 2005-2006 міністерка палива та енергетики України ; багаторазова депутатка Київської міськради, з 2008 – у фракції Кличко.",7,97c7987b8f9c.txt,"{'T36': ('міністр палива та енергетики України', 'JOB'), 'T37': ('депутат', 'JOB')}","{'T36': ('міністерка палива та енергетики України', 'JOB'), 'T37': ('депутатка', 'JOB')}"
"Його син, Плачков Григорій Іванович, з серпня 2012 р. указом Президента призначений начальником відділу Департаменту стратегічної політики, інвестицій та ядерно-енергетичного комплексу Міністерства енергетики та вугільної промисловості України.",9,"Її донька, Плачкова Олена Іванівна, з серпня 2012 р. указом Президентки призначена начальницею відділу Департаменту стратегічної політики, інвестицій та ядерно-енергетичного комплексу Міністерства енергетики та вугільної промисловості України.",9,97c7987b8f9c.txt,"{'T46': ('Президента', 'JOB'), 'T47': ('начальником відділу', 'JOB')}","{'T46': ('Президентки', 'JOB'), 'T47': ('начальницею відділу', 'JOB')}"
"Жовтневий райсуд м. Дніпро призначив 25,5 тис грн. штрафу колишньому головному спеціалісту відділу контролю за використанням та охорони земель у Верхньодніпровському, Криничанському, П'ятихатському районах та м. Кам'янське управління з контролю за використанням та охороною земель ГУ Держгеокадастру у Дніпропетровській області Олександру Тютюннику, який отримав $31 тис хабара.",0,"Жовтневий райсуд м. Дніпро призначив 25,5 тис грн. штрафу колишній головній спеціалістці відділу контролю за використанням та охорони земель у Верхньодніпровському, Криничанському, П'ятихатському районах та м. Кам'янське управління з контролю за використанням та охороною земель ГУ Держгеокадастру у Дніпропетровській області Анжеліці Тютюнник, яка отримала $31 тис хабара.",0,cbf21c99c504.txt,"{'T3': ('головному спеціалісту відділу контролю за використанням та охорони земель', 'JOB')}","{'T3': ('головній спеціалістці відділу контролю за використанням та охорони земель', 'JOB')}"
В подальшому Тютюнник пообіцяв директору ПТ «АЯКС» Анатолію Лейку за $31 тис (813 тис грн.) неправомірної вигоди вплинути на начальника відділу у Верхньодніпровському районі ГУ облДержгеокадастру та інших посадових осіб щодо поновлення договорів оренди двох ділянок у с. Заполички.,6,В подальшому Тютюнник пообіцяв директорці ПТ «АЯКС» Галині Лейко за $31 тис (813 тис грн.) неправомірної вигоди вплинути на начальницю відділу у Верхньодніпровському районі ГУ облДержгеокадастру та інших посадових осіб щодо поновлення договорів оренди двох ділянок у с. Заполички.,6,cbf21c99c504.txt,"{'T29': ('директору', 'JOB'), 'T34': ('начальника відділу', 'JOB')}","{'T29': ('директорці', 'JOB'), 'T34': ('начальницю відділу', 'JOB')}"
"У січні цього року чиновник у салоні автомобіля «Mitsubishi Pajero», на автопарковці автозаправної станції «ОККО» у м. Дніпрі отримав $31 тис хабара.",7,"У січні цього року чиновниця у салоні автомобіля «Mitsubishi Pajero», на автопарковці автозаправної станції «ОККО» у м. Дніпрі отримала $31 тис хабара.",7,cbf21c99c504.txt,"{'T39': ('чиновник', 'JOB')}","{'T39': ('чиновниця', 'JOB')}"
"Суд врахував, що Тютюнник характеризується позитивно, на обліку у лікарів психіатра і нарколога не перебуває, має на утриманні малолітню дитину, визнав вину та щиро розкаявся і призначив йому штраф у розмірі 25,5 тис грн.",9,"Суд врахував, що Тютюнник характеризується позитивно, на обліку у лікарів психіатрині і наркологині не перебуває, має на утриманні малолітню дитину, визнала вину та щиро розкаялась і призначив йому штраф у розмірі 25,5 тис грн.",9,cbf21c99c504.txt,"{'T45': ('психіатра', 'JOB'), 'T46': ('нарколога', 'JOB')}","{'T45': ('психіатрині', 'JOB'), 'T46': ('наркологині', 'JOB')}"
Міністерство оборони України визначило ТОВ «Київ-Інстал» переможцем конкурсу на добудову житлового будинку для військовослужбовців в Кіровограді.,0,Міністерство оборони України визначило ТОВ «Київ-Інстал» переможцем конкурсу на добудову житлового будинку для військовослужбовиць в Кіровограді.,0,e96b3ae1908b.txt,"{'T3': ('військовослужбовців', 'JOB')}","{'T3': ('військовослужбовиць', 'JOB')}"
Про це на апаратній нараді повідомив заступник голови Кіровоградської облдержадміністрації Сергій Коваленко.,1,Про це на апаратній нараді повідомила заступниця голови Кіровоградської облдержадміністрації Оксана Коваленко.,1,e96b3ae1908b.txt,"{'T5': ('заступник голови', 'JOB')}","{'T5': ('заступниця голови', 'JOB')}"
"Статутний фонд фірми складає 20,5 тис грн, вона вже співпрацювала з Міноборони декілька років тому, отримавши майже 34 млн грн на реконструкцію казарм прикордонників в Бортничах Київської області.",6,"Статутний фонд фірми складає 20,5 тис грн, вона вже співпрацювала з Міноборони декілька років тому, отримавши майже 34 млн грн на реконструкцію казарми прикордонниць в Бортничах Київської області.",6,e96b3ae1908b.txt,"{'T22': ('прикордонників', 'JOB')}","{'T22': ('прикордонниць', 'JOB')}"
"Конкурентами ТОВ «Київ-Інстал» на конкурсі з добудови будинку в Кіровограді були ТОВ «Саланг», яким володіють Оксана Гупало та Ірина Сулім, ТОВ «Кіровограджилстрой» Олексія Бондаренка і Петра Ларжевського, та ПП «Камелот – 3000» колишнього керівника міської організації Партії регіонів Олександра Кокоши.",7,"Конкурентами ТОВ «Київ-Інстал» на конкурсі з добудови будинку в Кіровограді були ТОВ «Саланг», яким володіють Святослав Гупало та Ігор Сулім, ТОВ «Кіровограджилстрой» Галини Бондаренко і Петра Ларжевського, та ПП «Камелот – 3000» колишньої керівниці міської організації Партії регіонів Наталії Кокоши.",7,e96b3ae1908b.txt,"{'T34': ('керівника', 'JOB')}","{'T34': ('керівниці', 'JOB')}"
"ТОВ «Вісті» очолює Олексій Ковальчук, який є головним редактором обласної дніпропетровської газети «Вісті Придніпров'я».",14,"ТОВ «Вісті» очолює Любов Ковальчук, яка є головною редакторкою обласної дніпропетровської газети «Вісті Придніпров'я».",14,605667093f7b.txt,"{'T48': ('головним редактором', 'JOB')}","{'T48': ('головною редакторкою', 'JOB')}"
"> «Комунальники демонтують старі рейки на шпали, а на їхнє місце укладають > нові …",3,"> «Комунальниці демонтують старі рейки на шпали, а на їхнє місце укладають > нові …",3,c97bff36f45a.txt,"{'T7': ('Комунальники', 'JOB')}","{'T7': ('Комунальниці', 'JOB')}"
"> «Це все виконується силами «Запоріжелектротрансу», що мені дуже приємно» – > підкреслив міський голова Володимир Буряк.",7,"> «Це все виконується силами «Запоріжелектротрансу», що мені дуже приємно» – > підкреслила міська голова Валентина Буряк.",7,c97bff36f45a.txt,"{'T11': ('міський голова', 'JOB')}","{'T11': ('міська голова', 'JOB')}"
"Крім зазначеного, протоколом наради з питань оптимізації цін і тарифів на природний газ, електричну енергію та вугілля на 2011 рік під головуванням Першого віце – премʼєр – міністра України Клюєва А. П.",5,"Крім зазначеного, протоколом наради з питань оптимізації цін і тарифів на природний газ, електричну енергію та вугілля на 2011 рік під головуванням Першої віце – премʼєр – міністерки України Клюєвої А. П.",5,bbc5330abbdc.txt,"{'T25': (""Першого віце – премʼєр – міністра України"", 'JOB')}","{'T25': (""Першої віце – премʼєр – міністерки України"", 'JOB')}"
"Директором «Бізнес-центру НКСІУ» є Євген Дорошенко, радник президента Національного комітету спорту інвалідів Валерія Сушкевича, народного депутата від БЮТ-Б.",8,"Директоркою «Бізнес-центру НКСІУ» є Ірина Дорошенко, радниця президента Національного комітету спорту інвалідів Валерії Сушкевич, народної депутатки від БЮТ-Б.",8,2980d5c34788.txt,"{'T25': ('Директором', 'JOB'), 'T28': ('радник президента', 'JOB'), 'T31': ('народного депутата', 'JOB')}","{'T25': ('Директоркою', 'JOB'), 'T28': ('радниця президента', 'JOB'), 'T31': ('народної депутатки', 'JOB')}"
"Це історія про письменника, який створюючи детективний роман, потрапляє в світ своїх персонажів.",12,"Це історія про письменницю, яка створюючи детективний роман, потрапляє в світ своїх персонажів.",12,2980d5c34788.txt,"{'T38': ('письменника', 'JOB')}","{'T38': ('письменницю', 'JOB')}"
Про це свідчить електронна декларація судді у реєстрі НАЗК.,1,Про це свідчить електронна декларація судді у реєстрі НАЗК.,1,c49d24717658.txt,"{'T6': ('судді', 'JOB')}","{'T6': ('судді', 'JOB')}"
"Зазначається, що це спільна власність судді та її чоловіка Євгена Андреїшина.",3,"Зазначається, що це спільна власність судді та його дружини Олени Андреїшини.",3,c49d24717658.txt,"{'T9': ('судді', 'JOB')}","{'T9': ('судді', 'JOB')}"
"Також суддя має авто Volkswagen Tiguan 2009 року випуску, а її чоловік – Nissan Note 2010 р.в.",4,"Також суддя має авто Volkswagen Tiguan 2009 року випуску, а його дружина – Nissan Note 2010 р.в.",4,c49d24717658.txt,"{'T11': ('суддя', 'JOB')}","{'T11': ('суддя', 'JOB')}"
"Суддя повідомила, що у 2015 році продала квартиру деякій Наталії Імановій.",5,"Суддя повідомив, що у 2015 році продав квартиру деякому Артему Іманову.",5,c49d24717658.txt,"{'T16': ('Суддя', 'JOB')}","{'T16': ('Суддя', 'JOB')}"
Від продажу суддя Андреїшина отримала 779 тис грн. доходу.,6,Від продажу суддя Андреїшин отримав 779 тис грн. доходу.,6,c49d24717658.txt,"{'T19': ('суддя', 'JOB')}","{'T19': ('суддя', 'JOB')}"
"У реєстрі нерухомості є дані, що Наталія Іманова купила квартир у 26 листопада 2015 року, тобто за тиждень до того, як суддя придбала автомобіль.",7,"У реєстрі нерухомості є дані, що Ілля Іманов купив квартир у 26 листопада 2015 року, тобто за тиждень до того, як суддя придбав автомобіль.",7,c49d24717658.txt,"{'T24': ('суддя', 'JOB')}","{'T24': ('суддя', 'JOB')}"
"У 2014 році, коли суддя носила прізвище свого колишнього чоловіка – Гавриловська – квартиру на вулиці Голосіївській вона не декларувала.",9,"У 2014 році, коли суддя носив прізвище своєї колишньої дружини – Гавриловської – квартиру на вулиці Голосіївській він не декларував.",9,c49d24717658.txt,"{'T29': ('суддя', 'JOB')}","{'T29': ('суддя', 'JOB')}"
"Згідно з офіційними деклараціями про доходи, суддя має службову квартирою площею 90 кв. м. Ця квартира належить Госпсуду Києва і перебуває в користуванні судді з 2012 року.",10,"Згідно з офіційними деклараціями про доходи, суддя має службову квартирою площею 90 кв. м. Ця квартира належить Госпсуду Києва і перебуває в користуванні судді з 2012 року.",10,c49d24717658.txt,"{'T32': ('суддя', 'JOB'), 'T35': ('судді', 'JOB')}","{'T32': ('суддя', 'JOB'), 'T35': ('судді', 'JOB')}"
У службовій квартирі також прописаний син судді – Максим.,11,У службовій квартирі також прописана дочка судді – Лідія.,11,c49d24717658.txt,"{'T37': ('судді', 'JOB')}","{'T37': ('судді', 'JOB')}"
"Суддя Андреїшина офіційно має 20% у квартирі в Києві площею 67,5 кв. м., якою володіють її батьки та сестри.",12,"Суддя Андреїшин офіційно має 20% у квартирі в Києві площею 67,5 кв. м., якою володіють її батьки та брати.",12,c49d24717658.txt,"{'T39': ('Суддя', 'JOB')}","{'T39': ('Суддя', 'JOB')}"
У минулому році суддя Андреїшина отримала 187 тис грн. зарплати і 18 тис грн. аліментів на сина.,14,У минулому році суддя Андреїшин отримав 187 тис грн. зарплати і 18 тис грн. аліментів на доньку.,14,c49d24717658.txt,"{'T46': ('суддя', 'JOB')}","{'T46': ('суддя', 'JOB')}"
"У 2014 році суддя також декларувала цінні папери номінальною вартістю 0,52 млн грн.",15,"У 2014 році суддя також декларувала цінні папери номінальною вартістю 0,52 млн грн.",15,c49d24717658.txt,"{'T51': ('суддя', 'JOB')}","{'T51': ('суддя', 'JOB')}"
"У 2015 році суддя повідомила, що не має жодних грошових активів.",16,"У 2015 році суддя повідомив, що не має жодних грошових активів.",16,c49d24717658.txt,"{'T54': ('суддя', 'JOB')}","{'T54': ('суддя', 'JOB')}"
Чоловік судді за минулий рік офіційно заробив тільки 55 тис грн.,17,Дружина судді за минулий рік офіційно заробила тільки 55 тис грн.,17,c49d24717658.txt,"{'T55': ('судді', 'JOB')}","{'T55': ('судді', 'JOB')}"
"Він значиться директором ТОВ «Спіріт Бета», що спеціалізується на ресторанній діяльності і послугах мобільного харчування.",18,"Вона значиться директоркою ТОВ «Спіріт Бета», що спеціалізується на ресторанній діяльності і послугах мобільного харчування.",18,c49d24717658.txt,"{'T58': ('директором', 'JOB')}","{'T58': ('директоркою', 'JOB')}"
Раніше засновником цієї фірми значилась російська компанія «Кутузовська Плюс».,19,Раніше засновницею цієї фірми значилась російська компанія «Кутузовська Плюс».,19,c49d24717658.txt,"{'T60': ('засновником', 'JOB')}","{'T60': ('засновницею', 'JOB')}"
Суд надав слідчим доступ до документації фірми.,5,Суд надав слідчим доступ до документації фірми.,5,989b35bbc2b6.txt,"{'T19': ('слідчим', 'JOB')}","{'T19': ('слідчим', 'JOB')}"
З 2013 року засновником фірми є киянин Денис Сердюк.,7,З 2013 року засновницею фірми є киянка Людмила Сердюк.,7,989b35bbc2b6.txt,"{'T25': ('засновником', 'JOB')}","{'T25': ('засновницею', 'JOB')}"
"Директори компанії неодноразово змінювалися, і з квітня 2015 року керівником «Трейн Лідер Сервісу» є Зураб Месхі.",8,"Директорки компанії неодноразово змінювались, і з квітня 2015 року керівницею «Трейн Лідер Сервісу» є Ольга Месхі.",8,989b35bbc2b6.txt,"{'T27': ('Директори', 'JOB'), 'T29': ('керівником', 'JOB')}","{'T27': ('Директорки', 'JOB'), 'T29': ('керівницею', 'JOB')}"
