original_sentence,orig_sent_id,changed_sentence,changed_sent_id,original_file_name,orig_ann,changed_ann
"Пізніше виявилося, що керівники ДП проходять по справі як свідки.",15,"Пізніше виявилося, що керівниці ДП проходять по справі як свідки.",15,e32c3effa79e.txt,"{'T60': ('керівники', 'JOB')}","{'T60': ('керівниці', 'JOB')}"
Раніше керівником «Етерни» був Леонід Малашкін – в. о. генерального директора Східного державного регіонального геологічного підприємства.,8,Раніше керівницею «Етерни» була Марія Малашкіна – в. о. генеральної директорки Східного державного регіонального геологічного підприємства.,8,f4119f5f8406.txt,"{'T23': ('керівником', 'JOB'), 'T26': ('в. о. генерального директора', 'JOB')}","{'T23': ('керівницею', 'JOB'), 'T26': ('в. о. генеральної директорки', 'JOB')}"
"За даними «The Guardian», станом на 2012 рік Кокседж числилась номінальним директором 709 офшорних компаній.",10,"За даними «The Guardian», станом на 2012 рік Кокседж числилась номінальною директоркою 709 офшорних компаній.",10,f4119f5f8406.txt,"{'T34': ('директором', 'JOB')}","{'T34': ('директоркою', 'JOB')}"
"Також Кокседж числилась керівником фірм, пов'язаних з екс-нардепом Юрієм Іванющенком, відомим як «смотрящий» колишнього президента Віктора Януковича.",12,"Також Кокседж числилась керівницею фірм, пов'язаних з екс-нардепкою Тетяною Іванющенко, відомою як «смотряща» колишньої президентки Надії Янукович.",12,f4119f5f8406.txt,"{'T39': ('керівником', 'JOB'), 'T40': ('екс-нардепом', 'JOB'), 'T42': ('президента', 'JOB')}","{'T39': ('керівницею', 'JOB'), 'T40': ('екс-нардепкою', 'JOB'), 'T42': ('президентки', 'JOB')}"
"ТОВ «Лінк-Медітал», де комерційним директором працював свіжепризначений заступник міністра охорони здоровʼя Ігор Іващенко, орендує офіс в ЖК дружини співробітника Служби безпеки Романа Неговелова.",0,"ТОВ «Лінк-Медітал», де комерційною директоркою працювала свіжепризначена заступниця міністра охорони здоровʼя Ганна Іващенко, орендує офіс в ЖК чоловіка співробітниці Служби безпеки Вікторії Неговелової.",0,cdc9c08df7ac.txt,"{'T2': ('комерційним директором', 'JOB'), 'T3': (""заступник міністра охорони здоровʼя"", 'JOB')}","{'T2': ('комерційною директоркою', 'JOB'), 'T3': (""заступниця міністра охорони здоровʼя"", 'JOB')}"
"Це дружина співробітника управління економічної контрозвідки СБУ Романа Неговелова, які він вказав в своїй декларації.",5,"Це чоловік співробітниці управління економічної контрозвідки СБУ Ольги Неговелової, які вона вказала у своїй декларації.",5,cdc9c08df7ac.txt,"{'T13': ('співробітника управління економічної контрозвідки', 'JOB')}","{'T13': ('співробітниці управління економічної контрозвідки', 'JOB')}"
"Раніше власник компанії «Діавіта» Сергій Ледін розказував про візит до нього Неговелова та його тодішнього начальника Миколу Беззубенка, які вимагали відкат з постачання ліків.",6,"Раніше власниця компанії «Діавіта» Ганна Ледіна розказувала про візит до неї Неговелової та її тодішньої начальниці Любові Беззубенко, які вимагали відкат з постачання ліків.",6,cdc9c08df7ac.txt,"{'T19': ('начальника', 'JOB')}","{'T19': ('начальниці', 'JOB')}"
Загалом згадані СБУшники були відомі як збирачі відкатів від постачальників саме медичного устаткування для голови економічної контррозвідки СБУ Сергія Семочка.,11,Загалом згадані СБУшниці були відомі як збирачки відкатів від постачальників саме медичного устаткування для голови економічної контррозвідки СБУ Наталії Семочко.,11,cdc9c08df7ac.txt,"{'T25': ('СБУшники', 'JOB'), 'T26': ('голови економічної контррозвідки', 'JOB')}","{'T25': ('СБУшниці', 'JOB'), 'T26': ('голови економічної контррозвідки', 'JOB')}"
"Після Після перемоги Володимира Зеленського і призначення головою спецслужби Івана Баканова, Беззубенко отримав підвищення всередині контророзвідки.",12,"Після Після перемоги Світлани Зеленської і призначення головою спецслужби Івана Баканова, Беззубенко отримала підвищення всередині контророзвідки.",12,cdc9c08df7ac.txt,"{'T30': ('головою спецслужби', 'JOB')}","{'T30': ('головою спецслужби', 'JOB')}"
"За даними ревізорів, кілька угод з цими фірмами призвели до збитків держкомпанії, або не були погоджені аудиторами.",5,"За даними ревізорок, кілька угод з цими фірмами призвели до збитків держкомпанії, або не були погоджені ревізорами.",5,4ea65724096f.txt,"{'T19': ('ревізорів', 'JOB'), 'T20': ('аудиторами', 'JOB')}","{'T19': ('ревізорок', 'JOB'), 'T20': ('ревізорами', 'JOB')}"
Найбільшим акціонером кіровоградського ПАТ «НВП Радій» є голова правління Євген Бахмач (23% акцій).,8,Найбільшою акціонеркою кіровоградського ПАТ «НВП Радій» є голова правління Євгенія Бахмач (23% акцій).,8,4ea65724096f.txt,"{'T31': ('голова правління', 'JOB')}","{'T31': ('голова правління', 'JOB')}"
ПрАТ «Сєвєродонецьке науково-виробниче об'єднання «Імпульс» контролюється головою правління Володимиром Єлісєєвим.,9,ПрАТ «Сєвєродонецьке науково-виробниче об'єднання «Імпульс» контролюється головою правління Володимиром Єлісєєвим.,9,4ea65724096f.txt,"{'T35': ('головою правління', 'JOB')}","{'T35': ('головою правління', 'JOB')}"
Засновниками ТОВ «Енергоплюс» зі статутним капіталом 68 тис грн. є киянин Дмитро Бондар та запоріжець Руслан Лопатко.,12,Засновницями ТОВ «Енергоплюс» зі статутним капіталом 68 тис грн. є киянка Галина Бондар та запоріжанка Світлана Лопатко.,12,4ea65724096f.txt,"{'T42': ('Засновниками', 'JOB')}","{'T42': ('Засновницями', 'JOB')}"
"В них має бути показано конкурентні переваги України, оглянуто нацпроекти, висвітелно діяльність Держінвестпроекту за допомогою цитат з інтерв'ю керівника відомства Владислава Каськіва, чільників держави, інвесторів.",3,"В них має бути показано конкурентні переваги України, оглянуто нацпроекти, висвітелено діяльність Держінвестпроекту за допомогою цитат з інтерв'ю керівниці відомства Владислави Каськів, чільників держави, інвесторів.",3,54a45ec4929b.txt,"{'T10': ('керівника', 'JOB')}","{'T10': ('керівниці', 'JOB')}"
"Основним власником ТОВ «Сон-це» є Орест Борко, ведучий на вечірках та весіллях.",5,"Основною власницею ТОВ «Сон-це» є Ольга Борко, ведуча на вечірках та весіллях.",5,54a45ec4929b.txt,"{'T15': ('ведучий', 'JOB')}","{'T15': ('ведуча', 'JOB')}"
"Інтерв'ю з керівником проекту, цитати Голови Держінвестпроекту та чільників держави, думка інвестора.",15,"Інтерв'ю з керівницею проекту, цитати Голови Держінвестпроекту та чільників держави, думка інвестора.",15,54a45ec4929b.txt,"{'T36': ('керівником', 'JOB'), 'T37': ('Голови Держінвестпроекту', 'JOB')}","{'T36': ('керівницею', 'JOB'), 'T37': ('Голови Держінвестпроекту', 'JOB')}"
"Увесь цей час єдиним підрядником, який відповідає організаційно-технічним вимогам митників було «Датагруп», яке також організувало близько 370 підключень митних підрозділів до мережі.",5,"Увесь цей час єдиним підрядником, який відповідає організаційно-технічним вимогам митників було «Датагруп», яке також організувало близько 370 підключень митних підрозділів до мережі.",5,4f2aecdde4c8.txt,"{'T9': ('митників', 'JOB')}","{'T9': ('митників', 'JOB')}"
"Минулого року митники виділяли для цих потреб 10,04 млн грн., позаминулого – 12,29 млн грн.",7,"Минулого року митники виділяли для цих потреб 10,04 млн грн., позаминулого – 12,29 млн грн.",7,4f2aecdde4c8.txt,"{'T13': ('митники', 'JOB')}","{'T13': ('митники', 'JOB')}"
Увесь час існування відомства його очолював Олександр Клименко з команди «молодореформаторів» екс-президента Віктора Януковича.,9,Увесь час існування відомства його очолювала Олександра Клименко з команди «молодореформаторів» екс-президентки Ірини Янукович.,9,4f2aecdde4c8.txt,"{'T20': ('екс-президента', 'JOB')}","{'T20': ('екс-президентки', 'JOB')}"
"В результаті цього тижня в. о. премʼєр-міністра Арсеній Яценюк заявив, що Міністерство реорганізують в Державну фіскальну службу.",13,"В результаті цього тижня в. о. премʼєр-міністра Арсенія Яценюк заявила, що Міністерство реорганізують в Державну фіскальну службу.",13,4f2aecdde4c8.txt,"{'T31': (""в. о. премʼєр-міністра"", 'JOB')}","{'T31': (""в. о. премʼєр-міністра"", 'JOB')}"
"KG), тобто розробник вказаного програмного забезпечення.",7,"KG), тобто розробниця вказаного програмного забезпечення.",7,e37120a0aa66.txt,"{'T14': ('розробник', 'JOB')}","{'T14': ('розробниця', 'JOB')}"
"Колишньому заступнику голови Дніпропетровської облради Віктору Науменку не вдалося вийти з-під варти на поруки народних депутатів, і він бере участь у засіданнях суду в режимі відеоконференції з Криворізької установи виконання покарань №3.",0,"Колишній заступниці голови Дніпропетровської облради Світлані Науменко не вдалося вийти з-під варти на поруки народних депутаток, і вона бере участь у засіданнях суду в режимі відеоконференції з Криворізької установи виконання покарань №3.",0,9452af41a134.txt,"{'T1': ('заступнику голови', 'JOB'), 'T4': ('народних депутатів', 'JOB')}","{'T1': ('заступниці голови', 'JOB'), 'T4': ('народних депутаток', 'JOB')}"
"3 жовтня апеляційний суд залишив без змін ухвалу дніпропетровського суду, який відмовився відпустити Науменка з-під варти на особисту поруку народних депутатів, або застосувати до нього інший запобіжний захід, не пов'язаний з триманням під вартою.",1,"3 жовтня апеляційний суд залишив без змін ухвалу дніпропетровського суду, який відмовився відпустити Науменка з-під варти на особисту поруку народних депутаток, або застосувати до нього інший запобіжний захід, не пов'язаний з триманням під вартою.",1,9452af41a134.txt,"{'T8': ('народних депутатів', 'JOB')}","{'T8': ('народних депутаток', 'JOB')}"
"Хто саме з нардепів був готовий поручитися за екс-чиновника, в ухвалах не вказано.",2,"Хто саме з нардепок була готова поручитися за екс-чиновницю, в ухвалах не вказано.",2,9452af41a134.txt,"{'T9': ('нардепів', 'JOB'), 'T10': ('екс-чиновника', 'JOB')}","{'T9': ('нардепок', 'JOB'), 'T10': ('екс-чиновницю', 'JOB')}"
"Зокрема, як повідомили правоохоронці, у 2011 році він передав в оренду на 49 років фірмі дочки своєї цивільної дружини майнового комплексу Аульскої хлоропереливної станції (Криничанський р-н, Дніпропетровської обл.) за заниженою орендною ставкою, що призвело до збитків у 2 млн грн.",7,"Зокрема, як повідомили правоохоронниці, у 2011 році він передав в оренду на 49 років фірмі дочки своєї цивільної дружини майнового комплексу Аульскої хлоропереливної станції (Криничанський р-н, Дніпропетровської обл.) за заниженою орендною ставкою, що призвело до збитків у 2 млн грн.",7,9452af41a134.txt,"{'T23': ('правоохоронці', 'JOB')}","{'T23': ('правоохоронниці', 'JOB')}"
"Нардеп Олег Ляшко називав його «Стас Губатий», вказуючи на його нібито причетність захоплення ринку брухту у Маріуполі після початку АТО.",10,"Нардепка Лариса Ляшко називала його «Стас Губатий», вказуючи на його нібито причетність захоплення ринку брухту у Маріуполі після початку АТО.",10,1adfefe0e695.txt,"{'T26': ('Нардеп', 'JOB')}","{'T26': ('Нардепка', 'JOB')}"
Про це повідомила державна уповноважена АМКУ Світлана Панаіотіді.,1,Про це повідомив державний уповноважений АМКУ Олександр Панаіотіді.,1,176e63516fab.txt,"{'T8': ('державна уповноважена', 'JOB')}","{'T8': ('державний уповноважений', 'JOB')}"
"Традиційно дорожники прописували необхідність надання підрядниками підтвердження щодо наявності або залучення асфальтобетонного заводу взагалі на будь якій відстані, найчастіше йдеться про довідку в довільній формі.",10,"Традиційно дорожниці прописували необхідність надання підрядниками підтвердження щодо наявності або залучення асфальтобетонного заводу взагалі на будь якій відстані, найчастіше йдеться про довідку в довільній формі.",10,176e63516fab.txt,"{'T26': ('дорожники', 'JOB')}","{'T26': ('дорожниці', 'JOB')}"
"Засновником ТОВ «Імені газети «Ізвєстія» є депутат Харківської облради, член постійної комісії з питань з питань аграрної політики, земельних відносин та природокористування Сергій Глобенко.",15,"Засновницею ТОВ «Імені газети «Ізвєстія» є депутатка Харківської облради, членкиня постійної комісії з питань з питань аграрної політики, земельних відносин та природокористування Валентина Глобенко.",15,8936d7a04255.txt,"{'T27': ('Засновником', 'JOB'), 'T29': ('депутат', 'JOB'), 'T31': ('член постійної комісії з питань з питань аграрної політики, земельних відносин та природокористування', 'JOB')}","{'T27': ('Засновницею', 'JOB'), 'T29': ('депутатка', 'JOB'), 'T31': ('членкиня постійної комісії з питань з питань аграрної політики, земельних відносин та природокористування', 'JOB')}"
"Участь тендері, окрім переможця, взяли також ПП «Ремтехбуд», ТОВ «Будспец монтаж» та підприємець Мар'ян Боляк.",6,"Участь тендері, окрім переможця, взяли також ПП «Ремтехбуд», ТОВ «Будспец монтаж» та підприємиця Клавдія Боляк.",6,996f3a16780e.txt,"{'T16': ('підприємець', 'JOB')}","{'T16': ('підприємиця', 'JOB')}"
"Львів», він колишній начальник управління капітального будівництва Львівської облдержадміністрації.",11,"Львів», вона колишня начальниця управління капітального будівництва Львівської облдержадміністрації.",11,996f3a16780e.txt,"{'T24': ('начальник управління', 'JOB')}","{'T24': ('начальниця управління', 'JOB')}"
"Також Овчаренко працював начальником управління (квартирно-експлуатаційного) Західного оперативного командування, головою Шевченківської райадміністрації Львівської міськради та директором ДП Міноборони України «Західвійськбуд».",12,"Також Овчаренко працювала начальницею управління (квартирно-експлуатаційного) Західного оперативного командування, головою Шевченківської райадміністрації Львівської міськради та директоркою ДП Міноборони України «Західвійськбуд».",12,996f3a16780e.txt,"{'T27': ('начальником управління', 'JOB'), 'T29': ('головою', 'JOB'), 'T31': ('директором', 'JOB')}","{'T27': ('начальницею управління', 'JOB'), 'T29': ('головою', 'JOB'), 'T31': ('директоркою', 'JOB')}"
"Їх засновниками є мешканці Харківської області Світлана Квіткова («Вікторі трейд»), Вікторія Рижило («Мірта стейт»), Ігор Фарбєєв («Гуд продакт трейд») і Наталія Яценко («Промлайн союз»).",8,"Їх засновницями є мешканці Харківської області Світлана Квіткова («Вікторі трейд»), Вікторія Рижило («Мірта стейт»), Ірина Фарбєєва («Гуд продакт трейд») і Наталія Яценко («Промлайн союз»).",8,c2a04d86bfb8.txt,"{'T24': ('засновниками', 'JOB')}","{'T24': ('засновницями', 'JOB')}"
"Нагадаємо, минулого року заступник голови наглядової ради групи компаній СЄПЕК Борис Тімонькін повідомив про придбання близько 40% акцій банку у братів Буряків.",9,"Нагадаємо, минулого року заступниця голови наглядової ради групи компаній СЄПЕК Марина Тімонькіна повідомила про придбання близько 40% акцій банку у братів Буряків.",9,c2a04d86bfb8.txt,"{'T35': ('заступник голови наглядової ради', 'JOB')}","{'T35': ('заступниця голови наглядової ради', 'JOB')}"
Михайло Вугман виступав в 2010 році спонсором вечеру-зустрічі єврейських бізнесменів з тодішнім президентом Ізраїлю Шимоном Пересом.,17,Михайло Вугман виступав в 2010 році спонсором вечору-зустрічі єврейських бізнесменів з тодішньою президенткою Ізраїлю Софією Перес.,17,cf79fc17c020.txt,"{'T37': ('президентом', 'JOB')}","{'T37': ('президенткою', 'JOB')}"
"Вдячність свідомим громадянам, що досконально вивчають портал держзакупівель і оприлюднюють підозрілу інформацію, висловив віце-премʼєр – міністр фінансів РФ Олексій Кудрін.",0,"Вдячність свідомим громадянам, що досконально вивчають портал держзакупівель і оприлюднюють підозрілу інформацію, висловила віце-премʼєрка – міністерка фінансів РФ Наталія Кудріна.",0,30933a298472.txt,"{'T1': (""віце-премʼєр"", 'JOB'), 'T2': ('міністр фінансів', 'JOB')}","{'T1': (""віце-премʼєрка"", 'JOB'), 'T2': ('міністерка фінансів', 'JOB')}"
