original_sentence,orig_sent_id,changed_sentence,changed_sent_id,original_file_name,orig_ann,changed_ann
"На початку 2011 року Південно-Західна залізниця за $2,53 млн. найняла юристів «Lalive» для представництва своїх інтересів по цій справі.",6,"На початку 2011 року Південно-Західна залізниця за $2,53 млн. найняла юристок «Lalive» для представництва своїх інтересів по цій справі.",6,c3156652dba3.txt,"{'T16': ('юристів', 'JOB')}","{'T16': ('юристок', 'JOB')}"
"Відтак обсяг юридичних послуг юридичної фірми «Lalive» як радника Південно-Західної залізниці збільшився, що і потребувало збільшення гонорару.",8,"Відтак обсяг юридичних послуг юридичної фірми «Lalive» як радниці Південно-Західної залізниці збільшився, що і потребувало збільшення гонорару.",8,c3156652dba3.txt,"{'T24': ('радника', 'JOB')}","{'T24': ('радниці', 'JOB')}"
"ПЗЗ також відмічає, що «заміна представника є недоцільною, оскільки юридична компанія «Lalive» показала досить позитивні результаті у даному процесі та дає можливість більш ефективніше вирішити даний спір ніж залучення іншого представника для захисту прав та інтересів Південно-Західної залізниці».",9,"ПЗЗ також відмічає, що «заміна представниці є недоцільною, оскільки юридична компанія «Lalive» показала досить позитивні результати у даному процесі та дає можливість більш ефективніше вирішити даний спір ніж залучення іншої представниці для захисту прав та інтересів Південно-Західної залізниці».",9,c3156652dba3.txt,"{'T27': ('представника', 'JOB'), 'T29': ('представника для захисту прав та інтересів', 'JOB')}","{'T27': ('представниці', 'JOB'), 'T29': ('представниці для захисту прав та інтересів', 'JOB')}"
"Залізничники вважають, що заміна юридичного радника або його відсутність у процесі загрожує програшем у справі.",10,"Залізничниці вважають, що заміна юридичної радниці або її відсутність у процесі загрожує програшем у справі.",10,c3156652dba3.txt,"{'T31': ('Залізничники', 'JOB'), 'T32': ('юридичного радника', 'JOB')}","{'T31': ('Залізничниці', 'JOB'), 'T32': ('юридичної радниці', 'JOB')}"
Засновником фірми «Стейс» нині є Люся Гордич з села Гоголів Київської обл. Раніше засновником «Стейсу» була Світлана Карплюк.,10,Засновницею фірми «Стейс» нині є Олександра Гордич з села Гоголів Київської обл. Раніше засновницею «Стейсу» була Аліна Карплюк.,10,c8944932e85f.txt,"{'T30': ('Засновником', 'JOB'), 'T35': ('засновником', 'JOB')}","{'T30': ('Засновницею', 'JOB'), 'T35': ('засновницею', 'JOB')}"
Це брат голови Держпідприємництва Михайла Бродського.,14,Це брат голови Держпідприємництва Любові Бродської.,14,c8944932e85f.txt,"{'T44': ('голови', 'JOB')}","{'T44': ('голови', 'JOB')}"
Директор «Юніонсервісу» Валентин Гордієнко раніше очолював ТД «Нафтопостач» з групи «Вік-ойл» народного депутата від Партії регіонів Юрія Іванющенка.,15,Директорка «Юніонсервісу» Лілія Гордієнко раніше очолювала ТД «Нафтопостач» з групи «Вік-ойл» народної депутатки від Партії регіонів Інни Іванющенко.,15,c8944932e85f.txt,"{'T47': ('Директор', 'JOB'), 'T52': ('народного депутата', 'JOB')}","{'T47': ('Директорка', 'JOB'), 'T52': ('народної депутатки', 'JOB')}"
Про це повідомила державна уповноважена АМКУ Агія Загребельська.,1,Про це повідомив державний уповноважений АМКУ Геннадій Загребельський.,1,372677bde8c8.txt,"{'T4': ('державна уповноважена', 'JOB')}","{'T4': ('державний уповноважений', 'JOB')}"
"Дорожники Хмельницької області висувають її іншу модифікацію, зазначаючи, що «відстань перевезення асфальтобетону … не може перевищувати відстані, протяжність якої забезпечує перевезення та зберігання суміші протягом не більше двох годин».",10,"Дорожниці Хмельницької області висувають її іншу модифікацію, зазначаючи, що «відстань перевезення асфальтобетону … не може перевищувати відстані, протяжність якої забезпечує перевезення та зберігання суміші протягом не більше двох годин».",10,372677bde8c8.txt,"{'T17': ('Дорожники', 'JOB')}","{'T17': ('Дорожниці', 'JOB')}"
Засновниками ТОВ «Еко-Сервіс» є Анатолій Шуляк і ТОВ «Володар – Роз».,13,Засновниками ТОВ «Еко-Сервіс» є Анна Шуляк і ТОВ «Володар – Роз».,13,0e6b8eb14491.txt,"{'T25': ('Засновниками', 'JOB')}","{'T25': ('Засновниками', 'JOB')}"
Засновниками останнього є кияни Олександр Власенко і Людмила Найденова.,14,Засновницями останнього є киянки Віра Власенко і Інна Найденова.,14,0e6b8eb14491.txt,"{'T29': ('Засновниками', 'JOB')}","{'T29': ('Засновницями', 'JOB')}"
Комунальники перерахували на рахунок фірми бюджетні кошти на придбання будівельних матеріалів.,5,Комунальниці перерахували на рахунок фірми бюджетні кошти на придбання будівельних матеріалів.,5,01cfbeca9827.txt,"{'T13': ('Комунальники', 'JOB')}","{'T13': ('Комунальниці', 'JOB')}"
"Разом з тим, як встановило слідство, директор ТОВ «ЛБК «Наш Дом» отримувала зі складу КП «Жилбудсервіс» безкоштовно гуманітарну допомогу у вигляді будівельних матеріалів, що надходила протягом 2014-2015 років від Міжнародного Комітету Червоного Хреста.",7,"Разом з тим, як встановило слідство, директорка ТОВ «ЛБК «Наш Дом» отримувала зі складу КП «Жилбудсервіс» безкоштовно гуманітарну допомогу у вигляді будівельних матеріалів, що надходила протягом 2014-2015 років від Міжнародного Комітету Червоного Хреста.",7,01cfbeca9827.txt,"{'T18': ('директор', 'JOB')}","{'T18': ('директорка', 'JOB')}"
"Слідчі отримали доступ до бухгалтерських документів «ЛБК «Наш Дом», які веде і зберігає у себе київське ТОВ «БОФ «Максим-Теко».",10,"Слідчі отримали доступ до бухгалтерських документів «ЛБК «Наш Дом», які веде і зберігає у себе київське ТОВ «БОФ «Максим-Теко».",10,01cfbeca9827.txt,"{'T28': ('Слідчі', 'JOB')}","{'T28': ('Слідчі', 'JOB')}"
З вересня 2014 року керівником КП «Жилбудсервіс» є Олексій Шевцов.,11,З вересня 2014 року керівницею КП «Жилбудсервіс» є Валентина Шевцова.,11,01cfbeca9827.txt,"{'T32': ('керівником', 'JOB')}","{'T32': ('керівницею', 'JOB')}"
"При цьому директором фірми став Олексій Шевцов, який пробув на цій посаді до осені 2014 року, після чого директором стала Чепурненко.",13,"При цьому директоркою фірми стала Наталія Шевцова, яка пробула на цій посаді до осені 2014 року, після чого директором став Чепурненко.",13,01cfbeca9827.txt,"{'T38': ('директором', 'JOB'), 'T41': ('директором', 'JOB')}","{'T38': ('директоркою', 'JOB'), 'T41': ('директором', 'JOB')}"
Чепурненко і Шевцов раніше також були співзасновниками ТОВ «Виробничо-торгова компанія «Металбудмаркет» і ТОВ «Виробнича комерційна компанія «Лугабуд».,14,Чепурненко і Шевцова раніше також були співзасновницями ТОВ «Виробничо-торгова компанія «Металбудмаркет» і ТОВ «Виробнича комерційна компанія «Лугабуд».,14,01cfbeca9827.txt,"{'T45': ('співзасновниками', 'JOB')}","{'T45': ('співзасновницями', 'JOB')}"
"Останній є сином відомого лікаря Еміля Фісталя, керівника Донецького опікового центру, якого пов'язують дружні стосунки з головою комітету Верховної Ради з питань охорони здоровʼя Тетяною Бахтєєвою (Партія регіонів).",6,"Останній є сином відомої лікарки Наталії Фісталь, керівниці Донецького опікового центру, яку пов'язують дружні стосунки з головою комітету Верховної Ради з питань охорони здоровʼя Тетяною Бахтєєвою (Партія регіонів).",6,64bbab373f73.txt,"{'T17': ('лікаря', 'JOB'), 'T19': ('керівника', 'JOB'), 'T21': ('головою', 'JOB')}","{'T17': ('лікарки', 'JOB'), 'T19': ('керівниці', 'JOB'), 'T21': ('головою', 'JOB')}"
"Єдиним конкурентом з різницею в 0,6% стало ТОВ «Ілатанмед», зареєстроване на Ольгу Писану, відому як бухгалтер ДП «Спеціальне конструкторсько-технологічне бюро з дослідним виробництвом» Інституту фізики напівпровідників та ТОВ «Фірма Крас».",9,"Єдиним конкурентом з різницею в 0,6% стало ТОВ «Ілатанмед», зареєстроване на Ольгу Писану, відому як бухгалтерка ДП «Спеціальне конструкторсько-технологічне бюро з дослідним виробництвом» Інституту фізики напівпровідників та ТОВ «Фірма Крас».",9,64bbab373f73.txt,"{'T32': ('бухгалтер', 'JOB')}","{'T32': ('бухгалтерка', 'JOB')}"
"ПП «Ашлар», співвласницею та керівником якого є матір керівника Миколаївської місцевої прокуратури №1 Дмитра Левицького Лідія Левицька, будує базу відпочинку у курортному селі Коблеве Березанського району Миколаївської області.",0,"ПП «Ашлар», співвласницею та керівницею якого є матір керівниці Миколаївської місцевої прокуратури №1 Наталії Левицької Лідія Левицька, будує базу відпочинку у курортному селі Коблеве Березанського району Миколаївської області.",0,fc3221dac69d.txt,"{'T2': ('керівником', 'JOB'), 'T3': ('керівника', 'JOB')}","{'T2': ('керівницею', 'JOB'), 'T3': ('керівниці', 'JOB')}"
Іншою співвласницею ПП «Ашлар» є мати депутата Коблівської сільської ради Олексія Осипенка Зінаїда Алімурадова.,2,Іншою співвласницею ПП «Ашлар» є мати депутатки Коблівської сільської ради Вікторії Осипенко Зінаїда Алімурадова.,2,fc3221dac69d.txt,"{'T15': ('депутата', 'JOB')}","{'T15': ('депутатки', 'JOB')}"
Осипенко – далекий родич сільського голови Коблеве Володимира Панича.,3,Осипенко – далека родичка сільської голови Коблеве Оксани Панич.,3,fc3221dac69d.txt,"{'T20': ('голови', 'JOB')}","{'T20': ('голови', 'JOB')}"
В Коблеве депутат Осипенко має 38 земельних ділянок.,4,В Коблеві депутатка Осипенко має 38 земельних ділянок.,4,fc3221dac69d.txt,"{'T24': ('депутат', 'JOB')}","{'T24': ('депутатка', 'JOB')}"
"Однак, як з'ясували журналісти, наразі Дмитро Левицький мешкає в будинку площею 354 кв. м у Миколаєві біля річки.",9,"Однак, як з'ясували журналістки, наразі Марина Левицька мешкає в будинку площею 354 кв. м у Миколаєві біля річки.",9,fc3221dac69d.txt,"{'T35': ('журналісти', 'JOB')}","{'T35': ('журналістки', 'JOB')}"
Однак у цій квартирі журналісти зустріли квартирантів.,15,Однак у цій квартирі журналістки зустріли квартирантів.,15,fc3221dac69d.txt,"{'T48': ('журналісти', 'JOB')}","{'T48': ('журналістки', 'JOB')}"
Лідія Левицька зареєструвалася як підприємець у 2007 р.,16,Лідія Левицька зареєструвалася як підприємиця у 2007 р.,16,fc3221dac69d.txt,"{'T50': ('підприємець', 'JOB')}","{'T50': ('підприємиця', 'JOB')}"
"Втім, другий позов військового прокурора задовольнили суди усіх інстанцій.",5,"Втім, другий позов військової прокурорки задовольнили суди усіх інстанцій.",5,39544dbbe184.txt,"{'T14': ('військового прокурора', 'JOB')}","{'T14': ('військової прокурорки', 'JOB')}"
У 2010 році він був обраний (по округу в Чугуєві) депутатом Харківської облради від Партії регіонів.,12,У 2010 році вона була обрана (по округу в Чугуєві) депутаткою Харківської облради від Партії регіонів.,12,39544dbbe184.txt,"{'T32': ('депутатом', 'JOB')}","{'T32': ('депутаткою', 'JOB')}"
"Крім того, з кінця грудня 2011 року він є першим заступником міського голови Чугуєва.",13,"Крім того, з кінця грудня 2011 року вона є першою заступницею міської голови Чугуєва.",13,39544dbbe184.txt,"{'T36': ('першим заступником міського голови', 'JOB')}","{'T36': ('першою заступницею міської голови', 'JOB')}"
"Заявку про бажання орендувати нерухомість подало ТОВ «ІФ-Західінвестсервіс», яке близьке до керівника держпідприємства-балансоутримувача Степана Маринчака.",4,"Заявку про бажання орендувати нерухомість подало ТОВ «ІФ-Західінвестсервіс», яке близьке до керівниці держпідприємства-балансоутримувача Галини Маринчак.",4,510661e4d39d.txt,"{'T9': ('керівника', 'JOB')}","{'T9': ('керівниці', 'JOB')}"
Заявка громадської організації стала підставою для керівника регіонального ФДМУ Зіновія Жовніра скасувати конкурс і передати приміщення в оренду на 25 років «Самопомочі».,8,Заявка громадської організації стала підставою для керівниці регіонального ФДМУ Олени Жовнір скасувати конкурс і передати приміщення в оренду на 25 років «Самопомочі».,8,510661e4d39d.txt,"{'T15': ('керівника', 'JOB')}","{'T15': ('керівниці', 'JOB')}"
Рішення ФДМУ на користь громадської організації може пояснюватися її наближеністю до керівника держпідприємства Степана Маринчака.,12,Рішення ФДМУ на користь громадської організації може пояснюватися її наближеністю до керівниці держпідприємства Олени Маринчак.,12,510661e4d39d.txt,"{'T25': ('керівника', 'JOB')}","{'T25': ('керівниці', 'JOB')}"
"Адже, керівник ГО Олександр Бондаренко є засновником та директором ТОВ «Івано-Франківський інститут геофізичних досліджень», яке зареєстрована за однією адресою з фірмами, що входять до орбіти керівника держпідприємства.",13,"Адже, керівниця ГО Галина Бондаренко є засновницею та директоркою ТОВ «Івано-Франківський інститут геофізичних досліджень», яке зареєстроване за однією адресою з фірмами, що входять до орбіти керівниці держпідприємства.",13,510661e4d39d.txt,"{'T27': ('керівник', 'JOB'), 'T30': ('засновником', 'JOB'), 'T31': ('директором', 'JOB'), 'T33': ('керівника', 'JOB')}","{'T27': ('керівниця', 'JOB'), 'T30': ('засновницею', 'JOB'), 'T31': ('директоркою', 'JOB'), 'T33': ('керівниці', 'JOB')}"
_ (додано дані щодо засновника фірми-переможця) _,0,_ (додано дані щодо засновниці фірми-переможця) _,0,ca414599779c.txt,"{'T1': ('засновника', 'JOB')}","{'T1': ('засновниці', 'JOB')}"
Засновником фірми зі статутним капіталом 5 тис грн. є Костянтин Леонідович Роєнко з міста Буча Київської області.,9,Засновницею фірми зі статутним капіталом 5 тис грн. є Катерина Леонідівна Роєнко з міста Буча Київської області.,9,ca414599779c.txt,"{'T14': ('Засновником', 'JOB')}","{'T14': ('Засновницею', 'JOB')}"
У відкритих джерелах з таким ПІБ згадується заступник директора державного підприємства «Центр археології Києва Інституту археології НАН України».,10,У відкритих джерелах з таким ПІБ згадується заступниця директора державного підприємства «Центр археології Києва Інституту археології НАН України».,10,ca414599779c.txt,"{'T19': ('заступник директора', 'JOB')}","{'T19': ('заступниця директора', 'JOB')}"
Таке ж ПІБ мав керівник ТОВ «Науково-практичний центр «Віче».,11,Таке ж ПІБ мала керівниця ТОВ «Науково-практичний центр «Віче».,11,ca414599779c.txt,"{'T22': ('керівник', 'JOB')}","{'T22': ('керівниця', 'JOB')}"
"Співзасновником цієї фірми є ТОВ «Проектне бюро «Юран» Валерія Нечитайло, який у 2006 році балотувався до парламенту по списку «Партії політики Путіна».",12,"Співзасновником цієї фірми є ТОВ «Проектне бюро «Юран» Валерії Нечитайло, яка у 2006 році балотувалася до парламенту по списку «Партії політики Путіна».",12,ca414599779c.txt,"{'T24': ('Співзасновником', 'JOB')}","{'T24': ('Співзасновником', 'JOB')}"
"Сагайдак відома як керівник галереї «Естамп», чиїм власником є Володимир Федчишин, якого називають експертом по антикваріату.",15,"Сагайдак відома як керівниця галереї «Естамп», чиєю власницею є Валентина Федчишина, яку називають експерткою по антикваріату.",15,ca414599779c.txt,"{'T35': ('керівник', 'JOB'), 'T38': ('експертом', 'JOB')}","{'T35': ('керівниця', 'JOB'), 'T38': ('експерткою', 'JOB')}"
"Наприклад, Остапенка називали водієм Анісімових, а Котляров виявився їхнім родичем, що підтвердив брат Євгена Анісімова – В'ячеслав.",6,"Наприклад, Остапенко називали водійкою Анісімових, а Котляров виявився їхнім родичем, що підтвердив брат Євгена Анісімова – В'ячеслав.",6,6350e46219ca.txt,"{'T14': ('водієм', 'JOB')}","{'T14': ('водійкою', 'JOB')}"
Частина фірм обслуговує також запорізькі міські маршрути та фігурувала в справі про зловживання службовим становищем вже колишнім начальником Управління з питань транспортного забезпечення і зв'язку Запорізької міськради Юрія Дроздова.,7,Частина фірм обслуговує також запорізькі міські маршрути та фігурувала в справі про зловживання службовим становищем вже колишньою начальницею Управління з питань транспортного забезпечення і зв'язку Запорізької міськради Ганни Дроздової.,7,6350e46219ca.txt,"{'T19': ('начальником', 'JOB')}","{'T19': ('начальницею', 'JOB')}"
