original_sentence,orig_sent_id,changed_sentence,changed_sent_id,original_file_name,orig_ann,changed_ann
"Нагадаємо, у 2008-2013 р. р. під керівництвом Непопа тендери «Житлоінвестбуду» на загальну суму 1,018 млрд грн. (що складає третину від усіх опублікованих закупівель цього комунального підприємства за вказаний період), виграли дві фірми – ТОВ «КЖБК» і ТОВ «Азур Груп» – які належать до групи компаній, пов'язаних із самим Непопом, а також його бізнес-партнером Михайлом Голицею, багаторазовим депутатом Київради, екс-очільником Управління будівництва та житлового забезпечення КМДА та «Київміськбуду».",12,"Нагадаємо, у 2008-2013 р. р. під керівництвом Непопа тендери «Житлоінвестбуду» на загальну суму 1,018 млрд грн. (що складає третину від усіх опублікованих закупівель цього комунального підприємства за вказаний період), виграли дві фірми – ТОВ «КЖБК» і ТОВ «Азур Груп» – які належать до групи компаній, пов'язаних із самим Непопом, а також його бізнес-партнеркою Анною Голицькою, багаторазовою депутаткою Київради, екс-очільницею Управління будівництва та житлового забезпечення КМДА та «Київміськбуду».",12,8e1267225acc.txt,"{'T30': ('бізнес-партнером', 'JOB'), 'T32': ('депутатом', 'JOB'), 'T34': ('екс-очільником', 'JOB')}","{'T30': ('бізнес-партнеркою', 'JOB'), 'T32': ('депутаткою', 'JOB'), 'T34': ('екс-очільницею', 'JOB')}"
Черкаське територіальне відділення АМКУ оштрафувало підприємця Аллу Ворошилову та ТОВ «Уманська дорожньо-будівельна компанія» загалом на 68 тис. грн за спотворення результатів торгів Джулинської сільради щодо закупівлі ремонтних робіт на одній із доріг у селі.,0,Черкаське територіальне відділення АМКУ оштрафувало підприємця Григорія Ворошилова та ТОВ «Уманська дорожньо-будівельна компанія» загалом на 68 тис. грн за спотворення результатів торгів Джулинської сільради щодо закупівлі ремонтних робіт на одній із доріг у селі.,0,8b3ec884f52d.txt,"{'T2': ('підприємця', 'JOB')}","{'T2': ('підприємця', 'JOB')}"
"Спірний тендер завершився для підприємиці Ворошилової та ТОВ «Уманська дорожньо-будівельна компанія» («УДБК») невдало – замовник з'ясував, що учасники є пов'язаними особами у розумінні Закону «Про публічні закупівлі», відхиливши їхні тендерні пропозиції.",2,"Спірний тендер завершився для підприємця Ворошилова та ТОВ «Уманська дорожньо-будівельна компанія» («УДБК») невдало – замовник з'ясував, що учасники є пов'язаними особами у розумінні Закону «Про публічні закупівлі», відхиливши їхні тендерні пропозиції.",2,8b3ec884f52d.txt,"{'T9': ('підприємиці', 'JOB')}","{'T9': ('підприємця', 'JOB')}"
Перемога дісталась третьому підприємцеві – Аветяну Арі.,3,Перемога дісталась третій підприємниці – Марії Арі.,3,8b3ec884f52d.txt,"{'T14': ('підприємцеві', 'JOB')}","{'T14': ('підприємниці', 'JOB')}"
* Директором та власником 50% статутного фонду ТОВ «УДБК» є Сергій Ворошилов – чоловік підприємиці Алли Ворошилової.,5,* Директоркою та власницею 50% статутного фонду ТОВ «УДБК» є Валентина Ворошилова – жінка підприємця Сергія Ворошилова.,5,8b3ec884f52d.txt,"{'T17': ('Директором', 'JOB'), 'T21': ('підприємиці', 'JOB')}","{'T17': ('Директоркою', 'JOB'), 'T21': ('підприємця', 'JOB')}"
"Зважаючи на встановлені факти, черкаські антимонопольники довели узгодженість дій між відповідачами, що призвела до спотворення результатів торгів.",7,"Зважаючи на встановлені факти, черкаські антимонопольниці довели узгодженість дій між відповідачами, що призвела до спотворення результатів торгів.",7,8b3ec884f52d.txt,"{'T26': ('антимонопольники', 'JOB')}","{'T26': ('антимонопольниці', 'JOB')}"
До призначення з липня 2015 року обіймала посаду начальника відділу розслідувань недобросовісної конкуренції невиробничої сфери Управління розслідувань Центрального апарату.,11,До призначення з липня 2015 року обіймала посаду начальниці відділу розслідувань недобросовісної конкуренції невиробничої сфери Управління розслідувань Центрального апарату.,11,8b3ec884f52d.txt,"{'T35': ('начальника відділу', 'JOB')}","{'T35': ('начальниці відділу', 'JOB')}"
"Придбано 4 однокімнатних квартири, 8 двокімнатних та 22 трикімнатних по 3460 грн. без ПДВ (продавець не є платником податку), що дешевше житла в житомирських новобудовах, а саме – 4180 грн. з ПДВ (наказ Мінрегіонбуду від 07.07.11 № 110).",2,"Придбано 4 однокімнатних квартири, 8 двокімнатних та 22 трикімнатних по 3460 грн. без ПДВ (продавчиня не є платником податку), що дешевше житла в житомирських новобудовах, а саме – 4180 грн. з ПДВ (наказ Мінрегіонбуду від 07.07.11 № 110).",2,357039d66ab7.txt,"{'T8': ('продавець', 'JOB')}","{'T8': ('продавчиня', 'JOB')}"
Після цього президент Віктор Янукович та уряд видали низку розпоряджень щодо забезпечення житлом цих пільгових категорій громадян.,11,Після цього президентка Вікторія Янукович та уряд видали низку розпоряджень щодо забезпечення житлом цих пільгових категорій громадян.,11,357039d66ab7.txt,"{'T19': ('президент', 'JOB')}","{'T19': ('президентка', 'JOB')}"
Засновниками ГО «Спортивний клуб «Бастіон» є депутати Іллічівськом міськради Сергій Червачов і Володимир Брільов.,13,Засновницями ГО «Спортивний клуб «Бастіон» є депутатки Іллічівськом міськради Інна Червачова і Анна Брільова.,13,258d2fd0d2fe.txt,"{'T25': ('Засновниками', 'JOB'), 'T27': ('депутати', 'JOB')}","{'T25': ('Засновницями', 'JOB'), 'T27': ('депутатки', 'JOB')}"
"У 2012 році ФК «Бастіон», президентом якого є Червачов, знявся зі змагань.",15,"У 2012 році ФК «Бастіон», президенткою якого є Червачова, знявся зі змагань.",15,258d2fd0d2fe.txt,"{'T34': ('президентом', 'JOB')}","{'T34': ('президенткою', 'JOB')}"
"При цьому, як виявили ревізори, відповідний договір між ДП і фірмою не укладався, а роботи фактично і не виконувались.",3,"При цьому, як виявили ревізорки, відповідний договір між ДП і фірмою не укладався, а роботи фактично і не виконувались.",3,535022e2bdd2.txt,"{'T9': ('ревізори', 'JOB')}","{'T9': ('ревізорки', 'JOB')}"
"В рамках цієї ж перевірки фінінспектори виявили, що дослідники придбали автомобіль Passat B7 вартістю 279 тис. грн, який передали на баланс іншої установи – якої саме, в повідомленні не уточнюється.",5,"В рамках цієї ж перевірки фінінспекторки виявили, що дослідниці придбали автомобіль Passat B7 вартістю 279 тис. грн, який передали на баланс іншої установи – якої саме, в повідомленні не уточнюється.",5,535022e2bdd2.txt,"{'T12': ('фінінспектори', 'JOB'), 'T13': ('дослідники', 'JOB')}","{'T12': ('фінінспекторки', 'JOB'), 'T13': ('дослідниці', 'JOB')}"
"Директором підприємства є Юлія Вержанська, Наглядову раду підприємства очолює Володимир Нечай.",14,"Директоркою підприємства є Юлія Вержанська, Наглядову раду підприємства очолює Володимир Нечай.",14,535022e2bdd2.txt,"{'T26': ('Директором', 'JOB')}","{'T26': ('Директоркою', 'JOB')}"
"Засновниками компанії «Ю. К.» значаться киянка Олена Попова, Дмитро Нітовський, за даними ЗМІ, у лютому 2015-го заступник директора ДП «Укрбурштин», а також ТОВ «Сітірум».",14,"Засновницями компанії «Ю. К.» значаться киянка Олена Попова, Олександра Нітовська, за даними ЗМІ, у лютому 2015-го заступниця директора ДП «Укрбурштин», а також ТОВ «Сітірум».",14,0f0e96425eed.txt,"{'T23': ('Засновниками', 'JOB'), 'T28': ('заступник директора', 'JOB')}","{'T23': ('Засновницями', 'JOB'), 'T28': ('заступниця директора', 'JOB')}"
"З відкритих джерел відомо, що ця жінка відома як директор більше 60 компаній.",19,"З відкритих джерел відомо, що ця жінка відома як директорка більше 60 компаній.",19,0f0e96425eed.txt,"{'T41': ('директор', 'JOB')}","{'T41': ('директорка', 'JOB')}"
Фонд держмайна України обрав ТОВ «Всеукраїнська Енерго Компанія» постачальником сировини Одеському припортовому заводу.,0,Фонд держмайна України обрав ТОВ «Всеукраїнська Енерго Компанія» постачальником сировини Одеському припортовому заводу.,0,6d47a8c4d755.txt,"{'T3': ('постачальником', 'JOB')}","{'T3': ('постачальником', 'JOB')}"
Про це повідомив перший заступник директора ПАТ «Одеський припортовий завод» Микола Щуріков.,1,Про це повідомила перша заступниця директорки ПАТ «Одеський припортовий завод» Наталя Щурікова.,1,6d47a8c4d755.txt,"{'T5': ('заступник директора', 'JOB')}","{'T5': ('заступниця директорки', 'JOB')}"
"За даними «Youcontrol», директором фірми є Сергій Довганюк, який також очолює ТОВ «Променергоресурс Україна» (код 41004567, також прописано в «Парусі») і ТОВ «Променергоресурс» (30215947).",3,"За даними «Youcontrol», директоркою фірми є Ніна Довганюк, яка також очолює ТОВ «Променергоресурс Україна» (код 41004567, також прописано в «Парусі») і ТОВ «Променергоресурс» (30215947).",3,6d47a8c4d755.txt,"{'T13': ('директором', 'JOB')}","{'T13': ('директоркою', 'JOB')}"
"Засновником «Всеукраїнської енерго компанії» є Вадим Колесніков, син бізнесмена з Рубіжного Луганської області Віталія Колеснікова.",8,"Засновницею «Всеукраїнської енерго компанії» є Галина Колеснікова, дочка бізнесменки з Рубіжного Луганської області Віталії Колеснікової.",8,6d47a8c4d755.txt,"{'T27': ('Засновником', 'JOB')}","{'T27': ('Засновницею', 'JOB')}"
"Обидва Колеснікови згадувались як члени наглядової ради ЗАТ «Енергомережа» до того, як фірму очолив Дмитро Крючков, що останні роки представляє інтереси нардепа від БПП Ігоря Кононенка.",9,"Обидві Колеснікови згадувались як членкині наглядової ради ЗАТ «Енергомережа» до того, як фірму очолила Ольга Крючкова, що останні роки представляє інтереси нардепки від БПП Галини Кононенко.",9,6d47a8c4d755.txt,"{'T34': ('члени наглядової ради', 'JOB'), 'T37': ('нардепа', 'JOB')}","{'T34': ('членкині наглядової ради', 'JOB'), 'T37': ('нардепки', 'JOB')}"
"Нагадаємо, до Майдану монопольним постачальником газу на Одеський припортовий завод була група Фірташа.",11,"Нагадаємо, до Майдану монопольним постачальником газу на Одеський припортовий завод була група Фірташа.",11,6d47a8c4d755.txt,"{'T44': ('постачальником', 'JOB')}","{'T44': ('постачальником', 'JOB')}"
"Після відлучення групи Фірташа від ОПЗ постачальниками заводу стали фірми, які були пов'язані з різними групами – оточенням Ігоря Кононенка, Арсенія Яценюка та Ігоря Коломойського.",13,"Після відлучення групи Фірташа від ОПЗ постачальниками заводу стали фірми, які були пов'язані з різними групами – оточенням Ігоря Кононенка, Арсенія Яценюка та Ігоря Коломойського.",13,6d47a8c4d755.txt,"{'T51': ('постачальниками', 'JOB')}","{'T51': ('постачальниками', 'JOB')}"
"По одній з кримінальних справ НАБУ затримувало керівників ОПЗ, у тому числі і Миколу Щурікова.",14,"По одній з кримінальних справ НАБУ затримувало керівниць ОПЗ, у тому числі і Ганну Щурікову.",14,6d47a8c4d755.txt,"{'T56': ('керівників', 'JOB')}","{'T56': ('керівниць', 'JOB')}"
В 2017 році постачальником газу на ОПЗ була група «Енергетичні ресурси України» Андрія Фаворова.,16,В 2017 році постачальником газу на ОПЗ була група «Енергетичні ресурси України» Андрія Фаворова.,16,6d47a8c4d755.txt,"{'T60': ('постачальником', 'JOB')}","{'T60': ('постачальником', 'JOB')}"
"Згідно із ЗУ «Про публічні закупівлі», дані учасники є пов'язаними особами, оскільки одна і та ж особа є їх засновником і володіє більше 25% у статутному капіталі обох підприємств.",9,"Згідно із ЗУ «Про публічні закупівлі», дані учасники є пов'язаними особами, оскільки одна і та ж особа є їх засновницею і володіє більше 25% у статутному капіталі обох підприємств.",9,798252fda0ab.txt,"{'T35': ('засновником', 'JOB')}","{'T35': ('засновницею', 'JOB')}"
Іван Гевак також подав е-декларацію за 2016 рік у якості завідувача господарства Західної філії «Українського державного центру радіочастот».,11,Олена Гевак також подала е-декларацію за 2016 рік у якості завідувачки господарства Західної філії «Українського державного центру радіочастот».,11,798252fda0ab.txt,"{'T39': ('завідувача господарства', 'JOB')}","{'T39': ('завідувачки господарства', 'JOB')}"
Засновником ДП «Полтавське управління геофізичних робіт» є Міністерство палива та енергетики України.,8,Засновником ДП «Полтавське управління геофізичних робіт» є Міністерство палива та енергетики України.,8,bf6104a5e8cc.txt,"{'T18': ('Засновником', 'JOB')}","{'T18': ('Засновником', 'JOB')}"
Засновником київського ТОВ «Укрістгаз» є австрійська компанія «Ітонс Холдинг ГМБХ».,9,Засновницею київського ТОВ «Укрістгаз» є австрійська компанія «Ітонс Холдинг ГМБХ».,9,bf6104a5e8cc.txt,"{'T21': ('Засновником', 'JOB')}","{'T21': ('Засновницею', 'JOB')}"
Керівником «Укрістгазу» є Володимир Крупко.,11,Керівницею «Укрістгазу» є Наталія Крупко.,11,bf6104a5e8cc.txt,"{'T29': ('Керівником', 'JOB')}","{'T29': ('Керівницею', 'JOB')}"
"Володимир Крупко є сином екс-міністра Кабінету міністрів Петра Крупка, що працював в обох урядах Тимошенко.",13,"Марина Крупко є донькою екс-міністерки Кабінету міністрів Олени Крупко, що працювала в обох урядах Тимошенко.",13,bf6104a5e8cc.txt,"{'T37': ('екс-міністра', 'JOB')}","{'T37': ('екс-міністерки', 'JOB')}"
"Суд задовольнив клопотання слідчих управління ГУ Національної поліції в Донецькій області, які розслідують кримінальне провадження № 42017050000000313 від 31.03.2017, і надав їм доступ до документації щодо ремонту інтернатів.",7,"Суд задовольнив клопотання слідчих управління ГУ Національної поліції в Донецькій області, які розслідують кримінальне провадження № 42017050000000313 від 31.03.2017, і надав їм доступ до документації щодо ремонту інтернатів.",7,5a43160b965d.txt,"{'T20': ('слідчих', 'JOB')}","{'T20': ('слідчих', 'JOB')}"
"Фірма «БК Будгарант 2010» була створена у кінці 2015 року, її засновником і керівником вказано В'ячеслава Дрюка з міста Костянтинівка.",8,"Фірма «БК Будгарант 2010» була створена у кінці 2015 року, її засновницею і керівницею вказано Ганну Дрюк з міста Костянтинівка.",8,5a43160b965d.txt,"{'T26': ('засновником', 'JOB'), 'T27': ('керівником', 'JOB')}","{'T26': ('засновницею', 'JOB'), 'T27': ('керівницею', 'JOB')}"
"Головний фахівець відділу організації реагування на надзвичайні ситуації головного управління ДСНС України у місті Києві Віталій Плевнік – не задекларував пожежний бізнес дружини, йдеться у сюжеті Надії Бурдей у телепрограмі «Наші гроші».",0,"Головна фахівчиня відділу організації реагування на надзвичайні ситуації головного управління ДСНС України у місті Києві Світлана Плевнік – не задекларувала пожежний бізнес чоловіка, йдеться у сюжеті Надії Бурдей у телепрограмі «Наші гроші».",0,5de8e21df21b.txt,"{'T1': ('Головний фахівець відділу організації реагування на надзвичайні ситуації', 'JOB')}","{'T1': ('Головна фахівчиня відділу організації реагування на надзвичайні ситуації', 'JOB')}"
Жінка посадовця Ірина Плевнік є співзасновницею компанії «Дозор ЛТД».,1,Чоловік посадовиці Гаврило Плевнік є співзасновником компанії «Дозор ЛТД».,1,5de8e21df21b.txt,"{'T6': ('посадовця', 'JOB'), 'T8': ('співзасновницею', 'JOB')}","{'T6': ('посадовиці', 'JOB'), 'T8': ('співзасновником', 'JOB')}"
"Також Ірина Плевнік – є дочкою Анатолія Косаря, екс-начальника управління пожежної безпеки головного управління МНС, екс-керівника управління екологічної політики та техногенної безпеки Кабміну.",3,"Також Ірина Плевнік – є дочкою Надії Косар, екс-начальниці управління пожежної безпеки головного управління МНС, екс-керівниці управління екологічної політики та техногенної безпеки Кабміну.",3,5de8e21df21b.txt,"{'T12': ('екс-начальника управління пожежної безпеки', 'JOB'), 'T14': ('екс-керівника управління екологічної політики та техногенної безпеки', 'JOB')}","{'T12': ('екс-начальниці управління пожежної безпеки', 'JOB'), 'T14': ('екс-керівниці управління екологічної політики та техногенної безпеки', 'JOB')}"
